{"record_kind":"runtime_snapshot_evidence","schema_version":"0.5.0","evidence_id":"runtime-snapshot-fixture-collected-with-limitations","collection_status":{"status":"collected_runtime_evidence","reason":"Fixture models a collected runtime snapshot with explicit limitations."},"snapshot_context":{"capture_kind":"fixture_sample","page_ref":"fixture://page/home"},"viewport_status":{"status":"collected_runtime_evidence","details":"Fixture viewport recorded."},"dom_status":{"status":"collected_runtime_evidence","details":"Fixture DOM snapshot recorded."},"computed_style_status":{"status":"collected_runtime_evidence","details":"Fixture computed style snapshot recorded."},"interaction_status":{"status":"insufficient_evidence","reason":"No interaction run was provided."},"source_ref":{"source_kind":"fixture_sample","source_id":"fixture:runtime-snapshot","observed_at":"2026-07-08T00:00:00Z"},"limitations":["Runtime fixture is captured-context evidence only.","It is not production evidence."],"not_proven_by_evidence":["production_ready","builder_executed","downstream_contract_enforced","official_docs_fully_covered","cross_repo_integrated","project_gate_integrated"]}
